{
  "$schema": "./schema/modules.schema.json",
  "version": "1.0",
  "tierCurve": {
    "comment": "Правило из решения №10: тир выше = лучше за слот, но хуже за кредит.",
    "statPerTier": 1.6,
    "costPerTier": 2.0,
    "powerPerTier": 1.7,
    "massPerTier": 1.25,
    "crewPerTier": 1.2,
    "consequence": "T1→T3 даёт ×2.5 характеристики за ×4 стоимости и ×3 энергии. Поэтому технологическое превосходство не абсолютно: бедная передовая фракция строит мало хороших кораблей, богатая отсталая — много посредственных."
  },
  "notes": [
    "powerDraw отрицательный означает выработку (реакторы).",
    "Броня — единственная защита с нулевым энергопотреблением, но самая тяжёлая.",
    "Щиты — наоборот, лёгкие и прожорливые. Это создаёт развилку: проект, у которого не",
    "хватает энергии, естественно уходит в броню, а проект с перегрузом по массе — в щиты."
  ],

  "modules": [
    {
      "id": "reactor_t1",
      "name": "Реактор Мк1",
      "family": "reactor",
      "slot": "utility",
      "tier": 1,
      "phase": 1,
      "powerDraw": -40,
      "mass": 25,
      "crew": 4,
      "cost": { "reactors": 1, "alloys": 4 },
      "tech": "start"
    },
    {
      "id": "reactor_t2",
      "name": "Реактор Мк2",
      "family": "reactor",
      "slot": "utility",
      "tier": 2,
      "phase": 1,
      "powerDraw": -70,
      "mass": 31,
      "crew": 5,
      "cost": { "reactors": 2, "alloys": 7, "superconductors": 1 },
      "tech": "power_2"
    },
    {
      "id": "reactor_t3",
      "name": "Реактор Мк3",
      "family": "reactor",
      "slot": "utility",
      "tier": 3,
      "phase": 1,
      "powerDraw": -120,
      "mass": 39,
      "crew": 6,
      "cost": { "reactors": 4, "alloys": 11, "superconductors": 3 },
      "tech": "power_3"
    },
    {
      "id": "reactor_t4",
      "name": "Реактор Мк4",
      "family": "reactor",
      "slot": "utility",
      "tier": 4,
      "phase": 2,
      "powerDraw": -200,
      "mass": 49,
      "crew": 7,
      "cost": { "reactors": 7, "alloys": 17, "superconductors": 7 },
      "tech": "power_4"
    },

    {
      "id": "thruster_t1",
      "name": "Двигатель Мк1",
      "family": "thruster",
      "slot": "propulsion",
      "tier": 1,
      "phase": 1,
      "thrust": 1200,
      "powerDraw": 8,
      "mass": 20,
      "crew": 2,
      "cost": { "thrusters": 1, "composites": 3 },
      "tech": "start"
    },
    {
      "id": "thruster_t2",
      "name": "Двигатель Мк2",
      "family": "thruster",
      "slot": "propulsion",
      "tier": 2,
      "phase": 1,
      "thrust": 1900,
      "powerDraw": 14,
      "mass": 25,
      "crew": 2,
      "cost": { "thrusters": 2, "composites": 5, "alloys": 2 },
      "tech": "propulsion_2"
    },
    {
      "id": "thruster_t3",
      "name": "Двигатель Мк3",
      "family": "thruster",
      "slot": "propulsion",
      "tier": 3,
      "phase": 1,
      "thrust": 3000,
      "powerDraw": 24,
      "mass": 31,
      "crew": 3,
      "cost": { "thrusters": 4, "composites": 8, "superconductors": 1 },
      "tech": "propulsion_3"
    },
    {
      "id": "thruster_t4",
      "name": "Двигатель Мк4",
      "family": "thruster",
      "slot": "propulsion",
      "tier": 4,
      "phase": 2,
      "thrust": 4800,
      "powerDraw": 41,
      "mass": 39,
      "crew": 4,
      "cost": { "thrusters": 7, "composites": 13, "superconductors": 3 },
      "tech": "propulsion_4"
    },

    {
      "id": "kinetic_t1",
      "name": "Рельсотрон Мк1",
      "family": "kinetic",
      "slot": "weapon",
      "tier": 1,
      "phase": 1,
      "damage": 30,
      "bands": ["medium", "short"],
      "vsShield": 0.6,
      "vsArmor": 1.3,
      "powerDraw": 6,
      "mass": 18,
      "crew": 3,
      "cost": { "weapons": 1, "alloys": 3 },
      "tech": "start"
    },
    {
      "id": "kinetic_t2",
      "name": "Рельсотрон Мк2",
      "family": "kinetic",
      "slot": "weapon",
      "tier": 2,
      "phase": 1,
      "damage": 48,
      "bands": ["medium", "short"],
      "vsShield": 0.6,
      "vsArmor": 1.3,
      "powerDraw": 10,
      "mass": 22,
      "crew": 3,
      "cost": { "weapons": 2, "alloys": 5 },
      "tech": "kinetic_2"
    },
    {
      "id": "kinetic_t3",
      "name": "Рельсотрон Мк3",
      "family": "kinetic",
      "slot": "weapon",
      "tier": 3,
      "phase": 1,
      "damage": 77,
      "bands": ["medium", "short"],
      "vsShield": 0.6,
      "vsArmor": 1.3,
      "powerDraw": 17,
      "mass": 28,
      "crew": 4,
      "cost": { "weapons": 4, "alloys": 9, "superconductors": 1 },
      "tech": "kinetic_3"
    },

    {
      "id": "laser_t1",
      "name": "Лазер Мк1",
      "family": "laser",
      "slot": "weapon",
      "tier": 1,
      "phase": 1,
      "damage": 26,
      "bands": ["long", "medium"],
      "vsShield": 1.4,
      "vsArmor": 0.7,
      "powerDraw": 14,
      "mass": 15,
      "crew": 3,
      "cost": { "weapons": 1, "optics": 2 },
      "tech": "energy_weapons_1"
    },
    {
      "id": "laser_t2",
      "name": "Лазер Мк2",
      "family": "laser",
      "slot": "weapon",
      "tier": 2,
      "phase": 1,
      "damage": 42,
      "bands": ["long", "medium"],
      "vsShield": 1.4,
      "vsArmor": 0.7,
      "powerDraw": 24,
      "mass": 19,
      "crew": 3,
      "cost": { "weapons": 2, "optics": 4, "superconductors": 1 },
      "tech": "energy_weapons_2"
    },
    {
      "id": "laser_t3",
      "name": "Лазер Мк3",
      "family": "laser",
      "slot": "weapon",
      "tier": 3,
      "phase": 1,
      "damage": 67,
      "bands": ["long", "medium"],
      "vsShield": 1.4,
      "vsArmor": 0.7,
      "powerDraw": 41,
      "mass": 23,
      "crew": 4,
      "cost": { "weapons": 4, "optics": 7, "superconductors": 2 },
      "tech": "energy_weapons_3"
    },

    {
      "id": "missile_t1",
      "name": "Ракетная установка Мк1",
      "family": "missile",
      "slot": "weapon",
      "tier": 1,
      "phase": 1,
      "damage": 45,
      "bands": ["long"],
      "vsShield": 1.0,
      "vsArmor": 1.0,
      "interceptable": true,
      "powerDraw": 5,
      "mass": 32,
      "crew": 3,
      "cost": { "weapons": 1, "composites": 3 },
      "tech": "start"
    },
    {
      "id": "missile_t2",
      "name": "Ракетная установка Мк2",
      "family": "missile",
      "slot": "weapon",
      "tier": 2,
      "phase": 1,
      "damage": 72,
      "bands": ["long"],
      "vsShield": 1.0,
      "vsArmor": 1.0,
      "interceptable": true,
      "powerDraw": 8,
      "mass": 40,
      "crew": 3,
      "cost": { "weapons": 2, "composites": 5, "electronics": 2 },
      "tech": "missiles_2"
    },
    {
      "id": "missile_t3",
      "name": "Торпедный аппарат",
      "family": "missile",
      "slot": "weapon",
      "tier": 3,
      "phase": 1,
      "damage": 115,
      "bands": ["long"],
      "vsShield": 1.0,
      "vsArmor": 1.0,
      "interceptable": true,
      "powerDraw": 14,
      "mass": 50,
      "crew": 4,
      "cost": { "weapons": 4, "composites": 8, "electronics": 4 },
      "tech": "missiles_3"
    },

    {
      "id": "plasma_t1",
      "name": "Плазменная пушка Мк1",
      "family": "plasma",
      "slot": "weapon",
      "tier": 1,
      "phase": 1,
      "damage": 55,
      "bands": ["short"],
      "vsShield": 1.0,
      "vsArmor": 1.15,
      "powerDraw": 20,
      "mass": 26,
      "crew": 4,
      "cost": { "weapons": 2, "superconductors": 1 },
      "tech": "plasma_1"
    },
    {
      "id": "plasma_t2",
      "name": "Плазменная пушка Мк2",
      "family": "plasma",
      "slot": "weapon",
      "tier": 2,
      "phase": 1,
      "damage": 88,
      "bands": ["short"],
      "vsShield": 1.0,
      "vsArmor": 1.15,
      "powerDraw": 34,
      "mass": 33,
      "crew": 4,
      "cost": { "weapons": 4, "superconductors": 2, "optics": 2 },
      "tech": "plasma_2"
    },
    {
      "id": "plasma_t3",
      "name": "Плазменная пушка Мк3",
      "family": "plasma",
      "slot": "weapon",
      "tier": 3,
      "phase": 1,
      "damage": 141,
      "bands": ["short"],
      "vsShield": 1.0,
      "vsArmor": 1.15,
      "powerDraw": 58,
      "mass": 41,
      "crew": 5,
      "cost": { "weapons": 7, "superconductors": 4, "optics": 4 },
      "tech": "plasma_3"
    },

    {
      "id": "pd_t1",
      "name": "Точечная оборона Мк1",
      "family": "point_defense",
      "slot": "defense",
      "tier": 1,
      "phase": 1,
      "intercept": 30,
      "damage": 8,
      "bands": ["short"],
      "vsShield": 0.8,
      "vsArmor": 0.8,
      "powerDraw": 8,
      "mass": 10,
      "crew": 2,
      "cost": { "weapons": 1, "electronics": 2 },
      "tech": "point_defense_1"
    },
    {
      "id": "pd_t2",
      "name": "Точечная оборона Мк2",
      "family": "point_defense",
      "slot": "defense",
      "tier": 2,
      "phase": 1,
      "intercept": 48,
      "damage": 13,
      "bands": ["short"],
      "vsShield": 0.8,
      "vsArmor": 0.8,
      "powerDraw": 14,
      "mass": 12,
      "crew": 2,
      "cost": { "weapons": 2, "electronics": 4 },
      "tech": "point_defense_2"
    },
    {
      "id": "pd_t3",
      "name": "Точечная оборона Мк3",
      "family": "point_defense",
      "slot": "defense",
      "tier": 3,
      "phase": 1,
      "intercept": 77,
      "damage": 21,
      "bands": ["short"],
      "vsShield": 0.8,
      "vsArmor": 0.8,
      "powerDraw": 24,
      "mass": 15,
      "crew": 3,
      "cost": { "weapons": 3, "electronics": 7 },
      "tech": "point_defense_3"
    },

    {
      "id": "shield_t1",
      "name": "Щит Мк1",
      "family": "shield",
      "slot": "defense",
      "tier": 1,
      "phase": 1,
      "shieldHp": 120,
      "shieldRegen": 18,
      "powerDraw": 20,
      "mass": 14,
      "crew": 2,
      "cost": { "shields": 1, "superconductors": 1 },
      "tech": "shields_1"
    },
    {
      "id": "shield_t2",
      "name": "Щит Мк2",
      "family": "shield",
      "slot": "defense",